<?xml version="1.0"?>
<!DOCTYPE brutis SYSTEM "brutis.dtd">
<brutis>
    <test name='Set_Get' desc='Set/Get test' version='1.0'>
        <jobset name='set_get'>
            <dataset>
                <key name='set' start='1' end='10000' pattern='sequential' prefix='brutis-' divide='false'/>
                <key name='get' start='1' end='10000' pattern='sequential' prefix='brutis-' divide='false'/>
                <value name='generated' mode='generated' size='256'/>
            </dataset>
            <operations>
                <operation type='set' keyset='set' valueset='generated'/>
                <operation type='get' keyset='get'/>
                <operation type='get' keyset='get'/>
                <operation type='get' keyset='get'/>
                <operation type='get' keyset='get'/>
                <operation type='get' keyset='get'/>
                <operation type='get' keyset='get'/>
                <operation type='get' keyset='get'/>
                <operation type='get' keyset='get'/>
                <operation type='get' keyset='get'/>
                <operation type='get' keyset='get'/>
            </operations>
        </jobset>
    </test>
</brutis>
