<?xml version="1.0"?>
<!DOCTYPE brutis SYSTEM "brutis.dtd">
<brutis>
    <test name='Replace' desc='Replace test' version='1.0'>
        <jobset name='replace_test' time='1200'>
            <dataset>
                <key name='set' start='1' end='1000000' pattern='sequential' prefix='brutis-' divide='true'/>
                <key name='replace' start='1' end='1000000' pattern='sequential' prefix='brutis-' divide='true'/>
                <key name='get' start='1' end='1000000' pattern='random' prefix='brutis-' divide='false'/>
                <value name='static' mode='static' size='18'>brutis static data</value>
            </dataset>
            <operations>
                <operation type='set' keyset='set' valueset='static'/>
                <operation type='replace' keyset='replace' valueset='static'/>
                <operation type='get' keyset='get'/>
            </operations>
        </jobset>
    </test>
</brutis>
