<?xml version="1.0"?>
<!DOCTYPE brutis SYSTEM "brutis.dtd">
<brutis>
    <test name='Delete' desc='Delete test' version='1.0'>
        <jobset name='delete test' forks='4' operations='10000000'>
            <dataset>
                <key name='set' start='1' end='1000000' pattern='sequential' prefix='brutis-' divide='true'/>
                <key name='delete' start='1' end='1000000' pattern='sequential' prefix='brutis-' divide='true'/>
                <key name='get' start='1' end='1000000' pattern='sequential' prefix='brutis-' divide='true'/>
                <value name='static' mode='static' size='18'>brutis static data</value>
            </dataset>
            <operations>
                <operation type='set' keyset='set' valueset='static'/>
                <operation type='delete' keyset='delete'/>
                <operation type='get' keyset='get'/>
            </operations>
        </jobset>
    </test>
</brutis>
